{"id":"i~gregtech~gt.blockmachines~14202","imageFilePath":"item/gregtech/gt.blockmachines~14202.png","internalName":"gt.blockmachines","itemDamage":14202,"itemId":2196,"localizedName":"巨型工业蜂箱","maxDamage":0,"maxStackSize":64,"modId":"gregtech","nbt":"","tooltip":"巨型工业蜂箱 (#2196/14202)\ngregtech:gt.blockmachines\n机器类型：巨型蜂箱\n巨型工业蜂箱的控制器方块\n添加者：kuba6000 \u0026 Runakai\n蜜蜂的理想家园\n使用螺丝刀切换基础模式(输入/输出/运行)\n手持螺丝刀Shift+右键以切换运行模式(常规/蜂群)\n--------------------- 输 入 模 式 ---------------------\n- 不消耗能量\n- 请将蜂后放入输入总线，机器会将其放入内部缓存区\n--------------------- 输 出 模 式 ---------------------\n- 不消耗能量\n- 会将你的蜜蜂重新输出到总线中\n------------------- 运 行 模 式 -------------------\n- 常规：\n  - 每多1A-LuV，可以多放入1只蜜蜂\n  - 基础运行时间：5秒\n  - 每只蜜蜂消耗1A LuV\n  - 所有蜜蜂加速64倍\n  - 自带8个产量升级\n  - 自带基因稳定升级\n  - 为你的蜜蜂模拟完美的环境\n  - 另外，你可以提供蜂王浆以提高产量：\n    - 1个蜂王浆为每只蜜蜂提供5%的增益\n    - 每次运行开始时消耗蜂王浆\n    - 只对当次运行生效\n    - 最大增益：200%\n- 蜂群：\n  - 只能放入1只蜂后\n  - 它会缓慢生产卑贱种公主蜂\n  - 每次运行消耗100蜂王浆\n  - 基础运行时间：1分钟\n  - 消耗1A-IV\n  - 可以超频\n请参考StructureLib全息投影，构建主体结构！\n-----------------------------------------\n按住 [LSHIFT] 以显示结构指导\n由 KubaTech 添加","unlocalizedName":"gt.blockmachines.multimachine.extremeapiary"}