{"id":"i~gregtech~gt.blockmachines~19046","imageFilePath":"item/gregtech/gt.blockmachines~19046.png","internalName":"gt.blockmachines","itemDamage":19046,"itemId":2196,"localizedName":"球状闪电","maxDamage":0,"maxStackSize":64,"modId":"gregtech","nbt":"","tooltip":"球状闪电 (#2196/19046)\ngregtech:gt.blockmachines\n机器类型: 电弧炉 | 等离子电弧炉 | 聚变反应堆 | 星核发生器\n球状闪电的的控制方块\n \n \" 我闭上眼睛又睁开. \"\n \" 玫瑰没有再出现, \"\n \" 但我知道它就在那里, \"\n \" 就插在紫水晶花瓶上. \"\n \n对能源最基础也是最终极的运用.\n至少需要无尽线圈才可成型\n机器拥有4个等级, 依次解锁4种模式,\n每升级一次机器等级, 更低级的机器模式获得4倍速.\n\u003d\u003d\u003d 机器等级 \u003d\u003d\u003d\n基础结构为等级1\n在主机内放入引力透镜解锁等级2\n在主机内放入升级芯片且使用2级结构解锁等级3\n使用进阶高能线圈解锁等级4\n\u003d\u003d\u003d 机器模式 \u003d\u003d\u003d\n 电弧炉 | 等离子电弧炉\n并行数 \u003d 2 ^ (聚变线圈等级 * (线圈等级 - 10))\n粗制稳定力场发生器等级+ 解锁无损超频\n 聚变反应堆\n最高运行功耗为 4 ^ (聚变线圈等级 - 2) * 1.8 ^ (力场发生器等级 - 1) A MAX\n65536 并行, 无损超频\n聚变线圈等级决定配方等级\n 星核发生器\n几乎无限的并行, 升级力场发生器以获得更高的速度\n每升级一次力场发生器, 降低9.9%功耗\n-----------------------------------------\n结构太复杂了！\n请参考StructureLib全息投影，构建主体结构\n作者 : Goderium\n按住 [LSHIFT] 以显示结构指导\n添加模组: Twist Space Technology","unlocalizedName":"gt.blockmachines.nameballlightning"}