{"id":"i~gregtech~gt.blockmachines~9400","imageFilePath":"item/gregtech/gt.blockmachines~9400.png","internalName":"gt.blockmachines","itemDamage":9400,"itemId":2196,"localizedName":"Drone Centre","maxDamage":0,"maxStackSize":64,"modId":"gregtech","nbt":"","tooltip":"Drone Centre (#2196/9400)\ngregtech:gt.blockmachines\nMachine Type: Drone Centre\nDrone Center Controller\nDrone #10032, cleared for takeoff!\nMonitors multiblock machines in range.\nReplace maintenance hatch on other multi with drone downlink module.\nProvides maintenance, power control, monitoring and etc.\nRange is determined by drone tier: T1-32, T2-128, T3-512\nPlace drones in input bus; only one needed to operate.\nAutomatically upgrade based on the drone level in the input bus.\nThere is a chance per second that the drone will crash.\nChance is determined by drone tier: T1-1/28800, T2-1/172800, T3-0\nIf machine is too far, remote control would not available\n添加者：SilverMoon\n-----------------------------------------\n-----------------------------------------\n按住 [LSHIFT] 以显示结构指导\n由 Gregtech 添加","unlocalizedName":"gt.blockmachines.multimachine_dronecentre"}