{"id":"i~gregtech~gt.blockmachines~19059","imageFilePath":"item/gregtech/gt.blockmachines~19059.png","internalName":"gt.blockmachines","itemDamage":19059,"itemId":2196,"localizedName":"奇异物质聚合器","maxDamage":0,"maxStackSize":64,"modId":"gregtech","nbt":"","tooltip":"奇异物质聚合器 (#2196/19059)\ngregtech:gt.blockmachines\n机器类型: 模块化机械 - 奇异物质聚合器\n寄蜉蝣于天地，渺沧海之一粟。\n创建专用的时空, 高效地操作奇异物质.\n机器是叠层结构, 每层可以安装一种时空操作器方块.\n更高等级, 更多层数, 更多收益, 同时也有代价.\n    ---------------- 时空振荡器 ----------------\n基础运行耗时：等级越高, 耗时越短\n基础原料消耗：层数越多, 消耗量越少\n时空维护流体消耗：层数越多, 消耗量越多\n核心素和湮灭约束器消耗：等级越高, 层数越多, 消耗率越低\n    ---------------- 时空约束器 ----------------\n辅助材料消耗率：等级越高, 消耗率越低\n实际运行耗时：等级越高, 实际运行耗时越长\n时空维护流体消耗：层数越多, 消耗量越少\n    ---------------- 时空归并器 ----------------\n最大连续运行点数：等级越高, 连续运行点数上限越高\n副产物产出：层数越多, 产量越大\n耗电：等级越高层数越多耗电越高\n    ---------------- 时空维护流体 ----------------\n在主机UI内设置使用的时空维护流体:\n T1 \u003d 576L 熔融时空 | T2 \u003d 96L 熔融宇宙素 | T3 \u003d 16L 熔融磁流体约束恒星物质\n使用高级时空维护流体可以提高每个湮灭约束器和核心素可以制作的燃料棒数量,\n 并降低辅助材料和流体原料的消耗量. 副产物类型取决于使用的时空维护流体.\nT1: 熔融无尽和熔融海珀珍; T2: 熔融时空和熔融调律源金; T3: 熔融宇宙素;\n-----------------------------------------\n连续运行时将产出副产物和更多的主产物.\n每次成功运行时, 连续运行点数加一.\n持续提供充足的时空维护流体可保持连续运行状态. 否则中断运行.\n提供核心素获得二级产物\n如果有核心素输入则会消耗核心素并将一部分主产物替换为二级产物.\n同时副产物产量翻倍.\n在主机附近安装模块仓室可以显著提升机器性能.\n模块化机械系统\n-----------------------------------------\n结构太复杂了！\n请参考StructureLib全息投影，构建主体结构\n按住 [LSHIFT] 以显示结构指导\n添加模组: Twist Space Technology","unlocalizedName":"gt.blockmachines.namestrangematteraggregator"}